{
  "section": "ironmaking",
  "reviewed": false,
  "glossary": [
    { "term": "용선", "aliases": ["쇳물"] },
    { "term": "고로", "aliases": ["용광로"] },
    { "term": "일산화탄소", "aliases": ["CO"] }
  ],
  "concepts": [
    {
      "concept_id": "sinter_purpose",
      "name": "소결의 목적",
      "key_points": [
        {
          "point": "소결은 철광석을 고로에 넣기 좋은 소결광으로 만드는 전처리 공정이다.",
          "quote": "이 기사에서 소결은 철광석을 고로에 사용하기 좋은 소결광으로 만드는 전처리 공정으로 소개된다."
        }
      ],
      "correct": "소결이 철광석을 고로용 소결광으로 만드는 전처리라는 점을 설명한다.",
      "partial": "철광석을 가공한다는 것은 알지만, 고로에 넣기 위한 전처리라는 목적을 말하지 못한다.",
      "wrong": "소결을 철광석을 녹여 쇳물을 만드는 공정이나 석탄을 코크스로 만드는 공정으로 설명한다.",
      "answer_terms": ["소결광", "전처리"],
      "questions": [
        "소결 공정은 어떤 원료를 무엇으로 바꾸고, 그렇게 바꾼 것은 다음에 어느 설비에서 쓰이나요? 이 공정이 제선 흐름에서 어떤 성격의 단계인지도 말해 주세요.",
        "제선 흐름 속 소결 공정이 맡은 일을, 무엇을 무엇으로 바꾸어 어디로 보내는 단계인지 들어 설명해 주세요."
      ],
      "recheck_questions": [
        "만약 소결 공정을 건너뛴다면 다음 설비에 들어갈 원료 준비에서 무엇이 빠지게 될까요? 소결 공정이 무엇을 무엇으로 만들어 어디에 대 주는 단계인지와 함께 설명해 주세요.",
        "소결 공정에서는 어떤 원료로 무엇을 만들고, 그것을 따로 만드는 까닭은 다음 설비와 어떤 관계가 있나요?"
      ],
      "fallback_question": "철광석을 가루 상태 그대로 쓰지 않고 소결 공정을 거치는 이유를 설명해 주세요.",
      "equipment_ids": ["sinter_plant", "blast_furnace"],
      "source": {
        "file": "backend/data/ironmaking-sources.json",
        "ref": "posco-newsroom-fe-2019"
      }
    },
    {
      "concept_id": "coke_reduction",
      "name": "고로에서 코크스의 역할",
      "key_points": [
        {
          "point": "코크스는 열풍과 반응해 일산화탄소를 만든다.",
          "quote": "고로에서 코크스가 열풍과 반응해 일산화탄소를 만들고, 일산화탄소는 철광석에서 산소를 떼어내는 환원에 관여한다."
        },
        {
          "point": "일산화탄소가 철광석에서 산소를 떼어내는 환원에 관여한다.",
          "quote": "고로에서 코크스가 열풍과 반응해 일산화탄소를 만들고, 일산화탄소는 철광석에서 산소를 떼어내는 환원에 관여한다."
        }
      ],
      "correct": "코크스가 일산화탄소를 만들고, 그것이 철광석의 산소를 떼어내는 환원에 쓰인다는 두 요소를 모두 설명한다.",
      "partial": "두 요소 중 하나만 설명하거나, '연료' 수준으로만 설명한다.",
      "wrong": "코크스가 용선의 탄소나 불순물을 제거한다고 설명한다(제강 전로의 역할과 혼동).",
      "answer_terms": ["일산화탄소", "환원"],
      "questions": [
        "고로 안에서 코크스는 무엇을 만나 어떤 물질을 만들고, 그 물질은 원료에 어떤 화학적 작용을 하나요?",
        "고로에 넣은 코크스가 무엇을 만나는 데서 시작해, 원료가 철로 바뀌는 화학 변화로 어떻게 이어지는지 차례로 설명해 주세요."
      ],
      "recheck_questions": [
        "고로 안의 코크스가 아무 역할도 하지 못한다면 원료에서 어떤 화학 변화가 일어나지 못할까요? 원래는 코크스가 무엇을 만나 무엇을 만들기 때문에 그 변화가 일어나는지 함께 설명해 주세요.",
        "원료가 철로 바뀌는 화학 변화를 이끄는 물질이 고로 안에서 어떻게 생기는지, 그리고 그 물질이 원료에 하는 일이 무엇인지 설명해 주세요."
      ],
      "fallback_question": "고로 안에서 코크스는 철광석이 철이 되는 데 어떤 역할을 하나요?",
      "equipment_ids": ["blast_furnace", "hot_stove"],
      "source": {
        "file": "backend/data/ironmaking-sources.json",
        "ref": "posco-newsroom-fe-2019"
      }
    },
    {
      "concept_id": "blast_furnace_hot_metal",
      "name": "고로에서 용선이 만들어지는 과정",
      "key_points": [
        {
          "point": "고로에서 환원과 용융이 일어나 용선이 된다.",
          "quote": "고로에서는 코크스가 산화하며 철광석의 산소를 떼어내는 환원과 용융이 일어나 용선이 된다."
        },
        {
          "point": "용선은 제강의 전로로 이어져 용강이 된다.",
          "quote": "고로에서 나온 용선은 제강의 전로로 이어지고, 탄소와 불순물을 줄여 용강을 만든다."
        }
      ],
      "correct": "고로에서 환원과 용융으로 용선이 만들어지고, 용선이 제강 전로로 이어진다는 점을 설명한다.",
      "partial": "용선이 만들어진다는 것은 알지만 환원·용융 과정이나 다음 공정과의 연결 중 하나를 빠뜨린다.",
      "wrong": "고로에서 바로 용강이나 제품이 나온다고 설명한다.",
      "answer_terms": ["환원", "용융", "전로", "제강", "용강"],
      "questions": [
        "고로 안에서 원료가 어떤 두 가지 변화를 거쳐 용선이 되는지, 그리고 그 용선은 다음에 어느 공정의 어떤 설비로 가서 무엇이 되는지 설명해 주세요.",
        "철광석이 고로에 들어가 용선이 되기까지 어떤 변화를 거치는지, 그리고 용선이 그다음 어느 공정의 어떤 설비에서 무엇으로 바뀌는지 차례로 설명해 주세요."
      ],
      "recheck_questions": [
        "다음 공정의 작업자 입장에서, 고로로부터 받은 용선을 어느 설비에 넣어 무엇을 만드는지, 그리고 그 용선이 고로 안에서 어떤 변화를 거쳐 만들어졌는지 설명해 주세요.",
        "철광석과 용선은 무엇이 다르고, 그 차이는 고로 안의 어떤 변화로 생기나요? 만들어진 용선이 다음에 어디로 가서 무엇이 되는지도 설명해 주세요."
      ],
      "fallback_question": "고로 안에서 철광석은 어떤 변화를 거쳐 쇳물로 바뀌고, 그 쇳물은 다음에 어느 공정으로 가나요?",
      "equipment_ids": ["blast_furnace", "taphole_casthouse", "torpedo_car"],
      "source": {
        "file": "backend/data/ironmaking-sources.json",
        "ref": "posco-brochure-2015"
      }
    }
  ]
}
